{
  "id": "studie-7933422",
  "type": "study",
  "title": "Dietary carotenoids, vitamins A, C, and E, and advanced age-related macular degeneration. Eye Disease Case-Control Study Group",
  "authors": "Seddon JM et al.",
  "year": 1994,
  "pmid": "7933422",
  "url": "https://pubmed.ncbi.nlm.nih.gov/7933422/"
}
