{
  "id": "studie-36345309",
  "type": "study",
  "title": "Reduction of anxiety and depressive symptoms with Hericium erinaceus intake: a randomized, double-blind placebo-controlled study",
  "authors": "Nagano M et al.",
  "year": 2023,
  "pmid": "36345309",
  "url": "https://pubmed.ncbi.nlm.nih.gov/36345309/"
}
