{
  "id": "studie-23389860",
  "type": "study",
  "title": "Probiotic use decreases intestinal inflammation and increases bone density in healthy male but not female mice",
  "authors": "Britton RA et al.",
  "year": 2014,
  "pmid": "23389860",
  "url": "https://pubmed.ncbi.nlm.nih.gov/23389860/"
}
