{
  "id": "studie-34107512",
  "type": "study",
  "title": "Efficacy of Creatine Supplementation and Resistance Training on Area and Density of Bone and Muscle in Older Adults",
  "authors": "Chilibeck PD et al.",
  "year": 2017,
  "pmid": "34107512",
  "url": "https://pubmed.ncbi.nlm.nih.gov/34107512/"
}
