{
  "id": "studie-23439798",
  "type": "study",
  "title": "A prospective, randomized double-blind, placebo-controlled study of safety and efficacy of a high-concentration full-spectrum extract of ashwagandha root in reducing stress and anxiety in adults",
  "authors": "Chandrasekhar K et al.",
  "year": 2012,
  "pmid": "23439798",
  "url": "https://pubmed.ncbi.nlm.nih.gov/23439798/"
}
