{
  "id": "studie-42467594",
  "type": "study",
  "title": "Astaxanthin Supplementation Lowers Respiratory Exchange Ratio During Submaximal Cycling in Females: A Randomized, Double-Blind, Placebo-Controlled Crossover Trial",
  "authors": "Various",
  "year": 2026,
  "pmid": "42467594",
  "url": "https://pubmed.ncbi.nlm.nih.gov/42467594/"
}
