{
  "id": "studie-30093983",
  "type": "study",
  "title": "Hericium erinaceus and cognitive function in mild cognitive impairment: a double-blind placebo-controlled clinical trial",
  "authors": "Mori K et al.",
  "year": 2019,
  "pmid": "30093983",
  "url": "https://pubmed.ncbi.nlm.nih.gov/30093983/"
}
