{
  "id": "studie-42410840",
  "type": "study",
  "title": "Impact of folic acid supplementation on cardiovascular risk among individuals with hemorrhagic stroke: A prospective study",
  "authors": "Zhao JV et al.",
  "year": 2022,
  "pmid": "42410840",
  "url": "https://pubmed.ncbi.nlm.nih.gov/42410840/"
}
