{
  "id": "studie-22071706",
  "type": "study",
  "title": "The relation of dietary choline to cognitive performance and white-matter hyperintensity in the Framingham Offspring Cohort",
  "authors": "Poly et al.",
  "year": 2011,
  "pmid": "22071706",
  "url": "https://pubmed.ncbi.nlm.nih.gov/22071706/"
}
