{
  "id": "studie-42057671",
  "type": "study",
  "title": "Biologically Active Ingredients and Underlying Mechanisms of Cordyceps in Treating Respiratory Diseases: A Comprehensive Review With Future Perspectives",
  "authors": "Zhang et al.",
  "year": 2026,
  "pmid": "42057671",
  "url": "https://pubmed.ncbi.nlm.nih.gov/42057671/"
}
