{
  "id": "studie-37432380",
  "type": "study",
  "title": "Dietary Supplements Containing Oat Beta-Glucan and/or Green Coffee (Poly)phenols Showed Limited Effect in Modulating Cardiometabolic Risk Biomarkers in Overweight/Obese Patients without a Lifestyle Intervention",
  "authors": "García-Cordero et al.",
  "year": 2023,
  "pmid": "37432380",
  "url": "https://pubmed.ncbi.nlm.nih.gov/37432380/"
}
