{
  "id": "studie-38070683",
  "type": "study",
  "title": "Effect of cocoa extract supplementation on cognitive function: results from the clinic subcohort of the COSMOS trial",
  "authors": "Vyas et al.",
  "year": 2024,
  "pmid": "38070683",
  "url": "https://pubmed.ncbi.nlm.nih.gov/38070683/"
}
