{
  "id": "studie-33587619",
  "type": "study",
  "title": "GlyNAC supplementation in older adults improves glutathione deficiency, oxidative stress, mitochondrial dysfunction and aging hallmarks",
  "authors": "Kumar P et al.",
  "year": 2021,
  "pmid": "33587619",
  "url": "https://pubmed.ncbi.nlm.nih.gov/33587619/"
}
