{
  "id": "studie-41804854",
  "type": "study",
  "title": "Alpha-lipoic acid as a preventive measure in radiation-induced oral mucositis in head and neck cancer patients: A randomized controlled study.",
  "authors": "Rizkalla BA et al.",
  "year": 2026,
  "pmid": "41804854",
  "url": "https://pubmed.ncbi.nlm.nih.gov/41804854/"
}
